"ground_truth_output","num_queries","original_output","original_score","original_text","perturbed_output","perturbed_score","perturbed_text","result_type"
0.0,76.0,0.0,0.006875574588775635,"bears is even [[worse]] than i imagined a movie ever could be .",1.0,0.9960014224052429,"bears is even [[pire]] than i imagined a movie ever could be .","Successful"
1.0,367.0,1.0,0.001990973949432373,"[[although]] estela bravo's [[documentary]] is cloyingly hagiographic in its portrait of cuban leader fidel castro , it's [[still]] a guilty pleasure to watch .",0.0,0.9326103329658508,"[[nonetheless]] estela bravo's [[paperwork]] is cloyingly hagiographic in its portrait of cuban leader fidel castro , it's [[once]] a guilty pleasure to watch .","Successful"
1.0,1.0,0.0,0.9987711906433105,"i have a new favorite musical -- and i'm not even a fan of the genre",0.0,0.9987711906433105,"i have a new favorite musical -- and i'm not even a fan of the genre","Skipped"
0.0,299.0,0.0,0.0005148649215698242,"it's [[lazy]] for a movie to [[avoid]] [[solving]] one problem by trying to distract us with the solution to another .",0.0,0.3752914071083069,"it's [[lethargic]] for a movie to [[evita]] [[resolves]] one problem by trying to distract us with the solution to another .","Successful"
1.0,221.0,1.0,0.002471745014190674,"[[even]] when he's not at his most critically insightful , godard can [[still]] be smarter than any 50 other filmmakers still at work .",0.0,0.8972935676574707,"[[again]] when he's not at his most critically insightful , godard can [[once]] be smarter than any 50 other filmmakers still at work .","Successful"
0.0,1.0,1.0,0.993793785572052,"more successful at relating history than in creating an emotionally complex , dramatically satisfying heroine",1.0,0.993793785572052,"more successful at relating history than in creating an emotionally complex , dramatically satisfying heroine","Skipped"
1.0,1.0,0.0,0.998732328414917,"it's unlikely we'll see a better thriller this year .",0.0,0.998732328414917,"it's unlikely we'll see a better thriller this year .","Skipped"
1.0,428.0,1.0,0.001867830753326416,"the story [[gives]] [[ample]] opportunity for large-scale action and suspense , which director shekhar kapur [[supplies]] with tremendous [[skill]] .",0.0,0.9538812637329102,"the story [[prescribes]] [[adequate]] opportunity for large-scale action and suspense , which director shekhar kapur [[foodstuffs]] with tremendous [[skills]] .","Successful"
0.0,290.0,0.0,0.0012558698654174805,"ultimately this is a [[frustrating]] patchwork : an uneasy marriage of louis begley's source novel ( about schmidt ) and an old payne [[screenplay]] .",1.0,0.9257593154907227,"ultimately this is a [[disenchanted]] patchwork : an uneasy marriage of louis begley's source novel ( about schmidt ) and an old payne [[arena]] .","Successful"
0.0,1.0,1.0,0.9787994623184204,"the threat implied in the title pokémon 4ever is terrifying  like locusts in a horde these things will keep coming .",1.0,0.9787994623184204,"the threat implied in the title pokémon 4ever is terrifying  like locusts in a horde these things will keep coming .","Skipped"
0.0,1598.0,0.0,0.0017235279083251953,"some [[writer]] [[dude]] , i [[think]] his [[name]] was , [[uh]] , [[michael]] zaidan , was [[supposed]] to have [[like]] [[written]] the [[screenplay]] or [[something]] , but , [[dude]] , the only [[thing]] that i [[ever]] [[saw]] that was [[written]] down were the [[zeroes]] on my [[paycheck]] .",0.0,0.0033638477325439453,"some [[author]] [[man]] , i [[believe]] his [[naming]] was , [[ah]] , [[miguel]] zaidan , was [[suspected]] to have [[genus]] [[typed]] the [[alphabet]] or [[nothing]] , but , [[buddy]] , the only [[somethings]] that i [[already]] [[noted]] that was [[wrote]] down were the [[zeros]] on my [[remuneration]] .","Failed"
0.0,39.0,0.0,0.0026917457580566406,"a sha-na-na sketch [[punctuated]] with graphic violence .",1.0,0.9972876310348511,"a sha-na-na sketch [[thunderous]] with graphic violence .","Successful"
1.0,376.0,1.0,0.0006294846534729004,"[[like]] the [[series]] , the [[movie]] is [[funny]] , [[smart]] , [[visually]] [[inventive]] , and most of all , [[alive]] .",1.0,0.30729979276657104,"[[similar]] the [[periodicals]] , the [[kino]] is [[odd]] , [[canny]] , [[audiovisual]] [[inventor]] , and most of all , [[inhabit]] .","Successful"
0.0,249.0,0.0,0.0004807710647583008,"perhaps even the slc high command [[found]] writer-director mitch davis's wall of kitsch [[hard]] going .",1.0,0.5027529001235962,"perhaps even the slc high command [[discovery]] writer-director mitch davis's wall of kitsch [[dur]] going .","Successful"
0.0,1.0,0.0,0.37850064039230347,"'es en verdad una pena que mandoki esté realizando cintas tan malas desde hace algún tiempo , pues talento tiene , pero quién sabe dónde lo tiene escondido . '",0.0,0.37850064039230347,"'es en verdad una pena que mandoki esté realizando cintas tan malas desde hace algún tiempo , pues talento tiene , pero quién sabe dónde lo tiene escondido . '","Skipped"
0.0,108.0,0.0,0.0004073977470397949,"the spalding gray [[equivalent]] of a [[teen]] gross-out comedy .",1.0,0.9968824982643127,"the spalding gray [[equals]] of a [[youthful]] gross-out comedy .","Successful"
0.0,39.0,0.0,0.0012192130088806152,"all [[mood]] and no [[movie]] .",0.0,0.002108633518218994,"all [[vibe]] and no [[cinematography]] .","Failed"
1.0,1.0,0.0,0.9993778467178345,"other than the slightly flawed ( and fairly unbelievable ) finale , everything else is top shelf .",0.0,0.9993778467178345,"other than the slightly flawed ( and fairly unbelievable ) finale , everything else is top shelf .","Skipped"
1.0,248.0,1.0,0.0019028782844543457,"[[despite]] an [[overwrought]] [[ending]] , the [[film]] [[works]] as [[well]] as it does because of the [[performances]] .",1.0,0.11295360326766968,"[[independently]] an [[edgy]] [[completion]] , the [[filming]] [[conjunction]] as [[okay]] as it does because of the [[performer]] .","Failed"
1.0,129.0,1.0,0.005985081195831299,"connoisseurs of chinese film will be pleased to discover that tian's meticulous talent has not [[withered]] during his enforced hiatus .",0.0,0.9952365159988403,"connoisseurs of chinese film will be pleased to discover that tian's meticulous talent has not [[bloomed]] during his enforced hiatus .","Successful"
0.0,240.0,0.0,0.0005165338516235352,"exploring value choices is a worthwhile topic for a film -- but here the choices are as [[contrived]] and [[artificial]] as kerrigan's platinum-blonde hair .",1.0,0.9143601655960083,"exploring value choices is a worthwhile topic for a film -- but here the choices are as [[supernatural]] and [[unholy]] as kerrigan's platinum-blonde hair .","Successful"
0.0,241.0,0.0,0.0006580948829650879,"a dark comedy that goes for sick and demented humor [[simply]] to do so . the movie is [[without]] intent .",1.0,0.9338575601577759,"a dark comedy that goes for sick and demented humor [[uncomplicated]] to do so . the movie is [[if]] intent .","Successful"
0.0,30.0,0.0,0.05234575271606445,"more trifle than [[triumph]] .",1.0,0.9750077128410339,"more trifle than [[triomphe]] .","Successful"
0.0,1.0,1.0,0.998518705368042,"entertains not so much because of its music or comic antics , but through the perverse pleasure of watching disney scrape the bottom of its own cracker barrel .",1.0,0.998518705368042,"entertains not so much because of its music or comic antics , but through the perverse pleasure of watching disney scrape the bottom of its own cracker barrel .","Skipped"
0.0,131.0,0.0,0.0006192922592163086,"directed in a [[flashy]] , empty sub-music video style by a director so self-possessed he actually adds a period to his first name",0.0,0.44918155670166016,"directed in a [[brilliant]] , empty sub-music video style by a director so self-possessed he actually adds a period to his first name","Successful"
0.0,649.0,0.0,0.000810086727142334,"the movie is [[concocted]] and carried out by folks worthy of scorn , and the [[nicest]] [[thing]] i can say is that i can't [[remember]] a [[single]] name responsible for it .",1.0,0.9017840027809143,"the movie is [[crafted]] and carried out by folks worthy of scorn , and the [[loveliest]] [[aspect]] i can say is that i can't [[reminisce]] a [[lonely]] name responsible for it .","Successful"
0.0,97.0,0.0,0.0010287761688232422,"aptly named , this shimmering , beautifully costumed and filmed production doesn't [[work]] for me .",1.0,0.9983689188957214,"aptly named , this shimmering , beautifully costumed and filmed production doesn't [[labor]] for me .","Successful"
1.0,61.0,1.0,0.0006738901138305664,"an enthralling , [[entertaining]] [[feature]] .",1.0,0.0028943419456481934,"an enthralling , [[amusement]] [[attribute]] .","Failed"
1.0,176.0,1.0,0.0007828474044799805,". . . a [[sweetly]] [[affecting]] story about four sisters who are coping , in one way or another , with life's endgame .",0.0,0.977898895740509,". . . a [[mildly]] [[afflicting]] story about four sisters who are coping , in one way or another , with life's endgame .","Successful"
0.0,96.0,0.0,0.0007968544960021973,"a slow-moving police-procedural [[thriller]] that takes its [[title]] all too [[literally]] .",1.0,0.9882780909538269,"a slow-moving police-procedural [[gripping]] that takes its [[name]] all too [[hardly]] .","Successful"
1.0,345.0,1.0,0.0011655688285827637,"the engagingly primitive [[animated]] special effects contribute to a mood that's [[sustained]] through the surprisingly [[somber]] conclusion .",0.0,0.6039333343505859,"the engagingly primitive [[prompted]] special effects contribute to a mood that's [[incessant]] through the surprisingly [[dreary]] conclusion .","Successful"
0.0,30.0,0.0,0.0012325048446655273,"it should be doing a [[lot]] of [[things]] , but doesn't .",0.0,0.0013440847396850586,"it should be doing a [[fate]] of [[matters]] , but doesn't .","Failed"
0.0,1.0,1.0,0.9887146949768066,"according to wendigo , 'nature' loves the members of the upper class almost as much as they love themselves .",1.0,0.9887146949768066,"according to wendigo , 'nature' loves the members of the upper class almost as much as they love themselves .","Skipped"
1.0,1.0,0.0,0.933979868888855,"i've yet to find an actual vietnam war combat movie actually produced by either the north or south vietnamese , but at least now we've got something pretty damn close .",0.0,0.933979868888855,"i've yet to find an actual vietnam war combat movie actually produced by either the north or south vietnamese , but at least now we've got something pretty damn close .","Skipped"
0.0,119.0,0.0,0.0012367963790893555,"'[[opening]] up' the [[play]] more has [[partly]] [[closed]] it down .",0.0,0.045911431312561035,"'[[open]] up' the [[cheek]] more has [[parte]] [[nears]] it down .","Failed"
0.0,271.0,0.0,0.000577092170715332,"the rules of attraction gets us too drunk on the party [[favors]] to sober us up with the [[transparent]] attempts at moralizing .",1.0,0.6696676015853882,"the rules of attraction gets us too drunk on the party [[prefer]] to sober us up with the [[clarity]] attempts at moralizing .","Successful"
1.0,1.0,0.0,0.9601516723632812,"leigh isn't breaking new ground , but he knows how a daily grind can kill love .",0.0,0.9601516723632812,"leigh isn't breaking new ground , but he knows how a daily grind can kill love .","Skipped"
1.0,1.0,0.0,0.9967754483222961,"it was filled with shootings , beatings , and more cussing than you could shake a stick at .",0.0,0.9967754483222961,"it was filled with shootings , beatings , and more cussing than you could shake a stick at .","Skipped"
0.0,315.0,0.0,0.0007140040397644043,"it has the right approach and the right opening premise , but it [[lacks]] the zest and it goes for a plot twist instead of [[trusting]] the material .",1.0,0.9982059597969055,"it has the right approach and the right opening premise , but it [[dearth]] the zest and it goes for a plot twist instead of [[relying]] the material .","Successful"
0.0,115.0,0.0,0.0014889836311340332,"ninety minutes of viva castro ! can be as [[tiresome]] as 9 seconds of jesse helms' anti- castro rhetoric , which are included",1.0,0.8365101218223572,"ninety minutes of viva castro ! can be as [[uninspiring]] as 9 seconds of jesse helms' anti- castro rhetoric , which are included","Successful"
1.0,184.0,1.0,0.0014795660972595215,"an enormously [[entertaining]] movie , like [[nothing]] we've ever seen before , and yet completely familiar .",0.0,0.9983299970626831,"an enormously [[comic]] movie , like [[nope]] we've ever seen before , and yet completely familiar .","Successful"
0.0,326.0,0.0,0.0015998482704162598,"after several [[scenes]] of this tacky nonsense , you'll be [[wistful]] for the testosterone-charged wizardry of jerry bruckheimer productions , especially because half past dead is like the rock on a wal-mart budget .",0.0,0.4639403820037842,"after several [[photography]] of this tacky nonsense , you'll be [[introspective]] for the testosterone-charged wizardry of jerry bruckheimer productions , especially because half past dead is like the rock on a wal-mart budget .","Successful"
0.0,1.0,1.0,0.6374742984771729,"blue crush has all the trappings of an energetic , extreme-sports adventure , but ends up more of a creaky "" pretty woman "" retread , with the emphasis on self-empowering schmaltz and big-wave surfing that gives pic its title an afterthought .",1.0,0.6374742984771729,"blue crush has all the trappings of an energetic , extreme-sports adventure , but ends up more of a creaky "" pretty woman "" retread , with the emphasis on self-empowering schmaltz and big-wave surfing that gives pic its title an afterthought .","Skipped"
1.0,204.0,1.0,0.004518389701843262,"even though we know the outcome , the seesawing of the general's fate in the arguments of competing lawyers has the stomach-knotting suspense of a legal thriller , while the testimony of witnesses [[lends]] the film a resonant undertone of tragedy .",0.0,0.947155773639679,"even though we know the outcome , the seesawing of the general's fate in the arguments of competing lawyers has the stomach-knotting suspense of a legal thriller , while the testimony of witnesses [[prescribes]] the film a resonant undertone of tragedy .","Successful"
0.0,75.0,0.0,0.0013762712478637695,"the [[romance]] between the [[leads]] isn't as [[compelling]] or as [[believable]] as it should be .",0.0,0.0018928050994873047,"the [[roman]] between the [[leeds]] isn't as [[conclusive]] or as [[reliably]] as it should be .","Failed"
0.0,224.0,0.0,0.0010544657707214355,"the movie is a [[little]] tired ; [[maybe]] the original inspiration has [[run]] its course .",0.0,0.3003743290901184,"the movie is a [[minimal]] tired ; [[apt]] the original inspiration has [[managed]] its course .","Successful"
1.0,280.0,1.0,0.0009569525718688965,"the story itself it mostly told through on-camera interviews with several survivors , [[whose]] riveting memories are rendered with such [[clarity]] that it's as if it all happened only yesterday .",0.0,0.9376736879348755,"the story itself it mostly told through on-camera interviews with several survivors , [[whoever]] riveting memories are rendered with such [[clarification]] that it's as if it all happened only yesterday .","Successful"
1.0,446.0,1.0,0.00042885541915893555,"a [[passionately]] inquisitive [[film]] determined to [[uncover]] the [[truth]] and [[hopefully]] [[inspire]] action .",0.0,0.8258511424064636,"a [[strenuously]] inquisitive [[kino]] determined to [[discloses]] the [[verdad]] and [[thankfully]] [[instil]] action .","Successful"
0.0,212.0,0.0,0.0003581047058105469,"a zombie movie in every sense of the word--mindless , lifeless , [[meandering]] , loud , [[painful]] , obnoxious .",1.0,0.9981265068054199,"a zombie movie in every sense of the word--mindless , lifeless , [[verdant]] , loud , [[painstaking]] , obnoxious .","Successful"
0.0,917.0,0.0,0.0009414553642272949,"the [[movie]] doesn't [[generate]] a [[lot]] of [[energy]] . it is [[dark]] , brooding and [[slow]] , and [[takes]] its [[central]] [[idea]] [[way]] too [[seriously]] .",0.0,0.0024884939193725586,"the [[film]] doesn't [[cause]] a [[many]] of [[electricity]] . it is [[bleak]] , brooding and [[slowdown]] , and [[chosen]] its [[critical]] [[inkling]] [[forma]] too [[strongly]] .","Failed"
1.0,488.0,1.0,0.0036260485649108887,"highlighted by a [[gritty]] style and an excellent cast , it's better than one [[might]] [[expect]] when you look at the list of movies starring ice-t in a major role .",0.0,0.9911198616027832,"highlighted by a [[joyless]] style and an excellent cast , it's better than one [[maybe]] [[await]] when you look at the list of movies starring ice-t in a major role .","Successful"
0.0,600.0,0.0,0.0015925765037536621,"the first [[mistake]] , i suspect , is [[casting]] shatner as a legendary professor and kunis as a [[brilliant]] college student--where's pauly shore as the [[rocket]] scientist ?",1.0,0.7574489116668701,"the first [[misspelled]] , i suspect , is [[blown]] shatner as a legendary professor and kunis as a [[marvelous]] college student--where's pauly shore as the [[howitzers]] scientist ?","Successful"
1.0,107.0,1.0,0.004357814788818359,"one of [jaglom's] better efforts -- a [[wry]] and sometime bitter movie about love .",0.0,0.9988980889320374,"one of [jaglom's] better efforts -- a [[sardonic]] and sometime bitter movie about love .","Successful"
0.0,72.0,0.0,0.0011182427406311035,"essentially , the film is [[weak]] on detail and strong on personality",1.0,0.9991708397865295,"essentially , the film is [[vulnerable]] on detail and strong on personality","Successful"
1.0,115.0,1.0,0.004636049270629883,"if it's unnerving suspense you're after -- you'll find it with ring , an indisputably [[spooky]] film ; with a screenplay to die for .",0.0,0.9994860291481018,"if it's unnerving suspense you're after -- you'll find it with ring , an indisputably [[dreadful]] film ; with a screenplay to die for .","Successful"
0.0,1.0,1.0,0.9957855343818665,"in terms of execution this movie is careless and unfocused .",1.0,0.9957855343818665,"in terms of execution this movie is careless and unfocused .","Skipped"
1.0,142.0,1.0,0.01594376564025879,"about the best thing you could say about narc is that it's a rock-solid [[little]] genre picture . whether you like it or not is basically a matter of taste .",0.0,0.998279333114624,"about the best thing you could say about narc is that it's a rock-solid [[scant]] genre picture . whether you like it or not is basically a matter of taste .","Successful"
1.0,130.0,1.0,0.0009120702743530273,"affable if not timeless , like mike raises some worthwhile themes while [[delivering]] a wholesome fantasy for kids .",0.0,0.8581954836845398,"affable if not timeless , like mike raises some worthwhile themes while [[offered]] a wholesome fantasy for kids .","Successful"
1.0,1.0,0.0,0.9921224117279053,"less cinematically powerful than quietly and deeply moving , which is powerful in itself .",0.0,0.9921224117279053,"less cinematically powerful than quietly and deeply moving , which is powerful in itself .","Skipped"
1.0,311.0,1.0,0.0004349350929260254,"a well-rounded [[tribute]] to a man whose achievements -- and complexities -- reached far [[beyond]] the end [[zone]] .",0.0,0.6319896578788757,"a well-rounded [[thanking]] to a man whose achievements -- and complexities -- reached far [[afterlife]] the end [[zoning]] .","Successful"
1.0,1.0,0.0,0.6174215078353882,"you won't look at religious fanatics -- or backyard sheds -- the same way again .",0.0,0.6174215078353882,"you won't look at religious fanatics -- or backyard sheds -- the same way again .","Skipped"
0.0,152.0,0.0,0.02929931879043579,"[a] boldly stroked , luridly coloured , uni-dimensional nonsense machine that strokes the eyeballs while it evaporates [[like]] so much crypt mist in the brain .",1.0,0.9981666207313538,"[a] boldly stroked , luridly coloured , uni-dimensional nonsense machine that strokes the eyeballs while it evaporates [[enjoy]] so much crypt mist in the brain .","Successful"
0.0,28.0,0.0,0.002986907958984375,"bearable . [[barely]] .",1.0,0.9976570010185242,"bearable . [[jen]] .","Successful"
1.0,235.0,1.0,0.0029828548431396484,"it's a [[testament]] to de niro and director michael caton-jones that by movie's end , we [[accept]] the characters and the film , flaws and all .",0.0,0.9818888902664185,"it's a [[testimonials]] to de niro and director michael caton-jones that by movie's end , we [[tolerate]] the characters and the film , flaws and all .","Successful"
1.0,93.0,1.0,0.0009821653366088867,"a [[solidly]] entertaining little [[film]] .",0.0,0.9993910193443298,"a [[vehemently]] entertaining little [[filming]] .","Successful"
0.0,193.0,0.0,0.0009802579879760742,"[[queen]] of the [[damned]] is too long with too [[little]] [[going]] on .",0.0,0.3589572310447693,"[[unadulterated]] of the [[cursed]] is too long with too [[small]] [[vanish]] on .","Successful"
1.0,125.0,1.0,0.0017715096473693848,"in his latest effort , storytelling , solondz has finally made a movie that isn't just offensive -- it also happens to be [[good]] .",0.0,0.8762689828872681,"in his latest effort , storytelling , solondz has finally made a movie that isn't just offensive -- it also happens to be [[opportune]] .","Successful"
0.0,294.0,0.0,0.0007928013801574707,"the film's [[trailer]] [[also]] [[looked]] [[like]] [[crap]] , so [[crap]] is what i was [[expecting]] .",0.0,0.0025055408477783203,"the film's [[towing]] [[again]] [[ticked]] [[likes]] [[shit]] , so [[shit]] is what i was [[wait]] .","Failed"
0.0,329.0,0.0,0.0011504888534545898,"koepp's [[screenplay]] isn't [[nearly]] surprising or [[clever]] enough to sustain a [[reasonable]] degree of suspense on its own .",1.0,0.5102064609527588,"koepp's [[screenwriting]] isn't [[scarcely]] surprising or [[adroit]] enough to sustain a [[justifiable]] degree of suspense on its own .","Successful"
1.0,1.0,0.0,0.9974950551986694,""" . . . something appears to have been lost in the translation this time . the importance of being earnest movie seems to be missing a great deal of the acerbic repartee of the play . """,0.0,0.9974950551986694,""" . . . something appears to have been lost in the translation this time . the importance of being earnest movie seems to be missing a great deal of the acerbic repartee of the play . ""","Skipped"
1.0,99.0,1.0,0.0013331174850463867,"the most [[consistently]] [[funny]] of the austin powers films .",0.0,0.9994677305221558,"the most [[ceaselessly]] [[odd]] of the austin powers films .","Successful"
1.0,165.0,1.0,0.003213047981262207,"if you can keep your eyes open amid all the blood and gore , you'll see del toro has brought [[unexpected]] gravity to blade ii .",0.0,0.9695388674736023,"if you can keep your eyes open amid all the blood and gore , you'll see del toro has brought [[accidental]] gravity to blade ii .","Successful"
0.0,309.0,0.0,0.0006260275840759277,"the big finish is a bit [[like]] getting all excited about a chocolate eclair and then biting into it and finding the filling [[missing]] .",1.0,0.9959417581558228,"the big finish is a bit [[loved]] getting all excited about a chocolate eclair and then biting into it and finding the filling [[unaccounted]] .","Successful"
1.0,28.0,1.0,0.0008624792098999023,"it's a very [[valuable]] film . . .",0.0,0.9964163303375244,"it's a very [[inestimable]] film . . .","Successful"
1.0,115.0,1.0,0.003192901611328125,"[[entertaining]] despite its one-joke premise with the thesis that women from venus and men from mars can indeed get together .",0.0,0.9989433288574219,"[[distracting]] despite its one-joke premise with the thesis that women from venus and men from mars can indeed get together .","Successful"
1.0,1.0,0.0,0.9946771860122681,""" what really happened ? "" is a question for philosophers , not filmmakers ; all the filmmakers need to do is engage an audience .",0.0,0.9946771860122681,""" what really happened ? "" is a question for philosophers , not filmmakers ; all the filmmakers need to do is engage an audience .","Skipped"
0.0,142.0,0.0,0.0007807016372680664,"it's a [[big]] idea , but the film itself is [[small]] and [[shriveled]] .",1.0,0.7904536724090576,"it's a [[hefty]] idea , but the film itself is [[petite]] and [[spindly]] .","Successful"
0.0,457.0,0.0,0.0008087754249572754,"`martin lawrence live' is so self-pitying , i [[almost]] expected there to be a [[collection]] taken for the [[comedian]] at the [[end]] of the [[show]] .",1.0,0.6904685497283936,"`martin lawrence live' is so self-pitying , i [[scarcely]] expected there to be a [[gather]] taken for the [[humor]] at the [[conclude]] of the [[spectacle]] .","Successful"
1.0,53.0,1.0,0.0008302927017211914,"one [[funny]] popcorn flick .",0.0,0.999333381652832,"one [[odd]] popcorn flick .","Successful"
0.0,604.0,0.0,0.0006322264671325684,"an [[inept]] , [[tedious]] [[spoof]] of '70s [[kung]] [[fu]] [[pictures]] , it [[contains]] [[almost]] [[enough]] [[chuckles]] for a three-minute [[sketch]] , and no more .",0.0,0.007488608360290527,"an [[inconvenient]] , [[arduous]] [[simulation]] of '70s [[jung]] [[tiger]] [[imagery]] , it [[involves]] [[approximately]] [[somewhat]] [[grin]] for a three-minute [[outline]] , and no more .","Failed"
1.0,136.0,1.0,0.0017797350883483887,"smith [[finds]] [[amusing]] juxtapositions that [[justify]] his exercise .",0.0,0.9671885371208191,"smith [[detects]] [[comical]] juxtapositions that [[legitimize]] his exercise .","Successful"
