"ground_truth_output","num_queries","original_output","original_score","original_text","perturbed_output","perturbed_score","perturbed_text","result_type"
0.0,194.0,0.0,0.0007704496383666992,"though there's a clarity of purpose and even-handedness to the film's direction , the drama feels [[rigged]] and [[sluggish]] .",1.0,0.9971337914466858,"though there's a clarity of purpose and even-handedness to the film's direction , the drama feels [[forged]] and [[lento]] .","Successful"
1.0,429.0,1.0,0.0007714033126831055,"[[symbolically]] , [[warm]] [[water]] under a red [[bridge]] is a [[celebration]] of feminine energy , a tribute to the power of women to heal .",0.0,0.8800718188285828,"[[signifying]] , [[lukewarm]] [[hydraulic]] under a red [[flyover]] is a [[commemoration]] of feminine energy , a tribute to the power of women to heal .","Successful"
0.0,100.0,0.0,0.003609597682952881,"[[veers]] [[uncomfortably]] close to pro-serb [[propaganda]] .",0.0,0.05688965320587158,"[[sputters]] [[shivered]] close to pro-serb [[advocacy]] .","Failed"
0.0,139.0,0.0,0.0006105899810791016,"the film [[never]] gets over its own investment in conventional arrangements , in terms of love , age , gender , race , and class .",1.0,0.7821545600891113,"the film [[siempre]] gets over its own investment in conventional arrangements , in terms of love , age , gender , race , and class .","Successful"
1.0,137.0,1.0,0.0037682652473449707,"a comedy-drama of [[nearly]] epic proportions rooted in a sincere performance by the title character undergoing midlife crisis .",0.0,0.9977744221687317,"a comedy-drama of [[scarcely]] epic proportions rooted in a sincere performance by the title character undergoing midlife crisis .","Successful"
0.0,683.0,0.0,0.0008214116096496582,"the [[premise]] itself is just sooooo [[tired]] . [[pair]] that with [[really]] [[poor]] [[comedic]] [[writing]] . . . and you've [[got]] a [[huge]] [[mess]] .",0.0,0.025270164012908936,"the [[prerequisite]] itself is just sooooo [[tiredness]] . [[coupled]] that with [[exactly]] [[insufficient]] [[humour]] [[editor]] . . . and you've [[am]] a [[tremendous]] [[jumble]] .","Failed"
0.0,443.0,0.0,0.0009488463401794434,"the lead [[actors]] [[share]] no [[chemistry]] or [[engaging]] [[charisma]] . we don't [[even]] [[like]] their [[characters]] .",0.0,0.003059983253479004,"the lead [[actresses]] [[portion]] no [[alchemy]] or [[engage]] [[attractiveness]] . we don't [[yet]] [[enjoy]] their [[characteristics]] .","Failed"
1.0,152.0,1.0,0.0009360909461975098,"my little eye is the [[best]] [[little]] "" horror "" movie i've seen in years .",0.0,0.9612815976142883,"my little eye is the [[exemplary]] [[minimal]] "" horror "" movie i've seen in years .","Successful"
1.0,82.0,1.0,0.0007600784301757812,"a movie of technical skill and [[rare]] depth of intellect and feeling .",0.0,0.9994302988052368,"a movie of technical skill and [[scant]] depth of intellect and feeling .","Successful"
1.0,197.0,1.0,0.0007967352867126465,"both exuberantly romantic and [[serenely]] [[melancholy]] , what time is it there ? [[may]] prove to be [tsai's] masterpiece .",0.0,0.9758589267730713,"both exuberantly romantic and [[serena]] [[sullen]] , what time is it there ? [[maybe]] prove to be [tsai's] masterpiece .","Successful"
0.0,95.0,0.0,0.03785228729248047,"in moonlight mile , no one gets shut out of the [[hug]] cycle .",1.0,0.8695381283760071,"in moonlight mile , no one gets shut out of the [[embracing]] cycle .","Successful"
1.0,124.0,1.0,0.0049201250076293945,"what's so striking about jolie's performance is that she [[never]] lets her character become a caricature -- not even with that radioactive hair .",0.0,0.9970780611038208,"what's so striking about jolie's performance is that she [[nada]] lets her character become a caricature -- not even with that radioactive hair .","Successful"
1.0,67.0,1.0,0.0013548731803894043,"what a dumb , [[fun]] , curiously adolescent movie this is .",0.0,0.9995819926261902,"what a dumb , [[entertainment]] , curiously adolescent movie this is .","Successful"
1.0,140.0,1.0,0.005101144313812256,"paid in full is remarkably [[engaging]] despite being noticeably derivative of goodfellas and at least a half dozen other trouble-in-the-ghetto flicks .",0.0,0.7007110118865967,"paid in full is remarkably [[incur]] despite being noticeably derivative of goodfellas and at least a half dozen other trouble-in-the-ghetto flicks .","Successful"
0.0,903.0,0.0,0.0009594559669494629,"[[supposedly]] based upon real , or at least soberly reported incidents , the film ends with a large human tragedy . [[alas]] , [[getting]] there is not [[even]] half the [[interest]] .",1.0,0.8292653560638428,"[[conceivably]] based upon real , or at least soberly reported incidents , the film ends with a large human tragedy . [[sadly]] , [[gain]] there is not [[until]] half the [[beware]] .","Successful"
1.0,323.0,1.0,0.002384662628173828,"the film occasionally tries the viewer's patience with slow pacing and a main character who sometimes defies sympathy , but it ultimately [[satisfies]] with its [[moving]] story .",0.0,0.9585438966751099,"the film occasionally tries the viewer's patience with slow pacing and a main character who sometimes defies sympathy , but it ultimately [[completes]] with its [[resettled]] story .","Successful"
1.0,1.0,0.0,0.9953575730323792,"missteps take what was otherwise a fascinating , riveting story and send it down the path of the mundane .",0.0,0.9953575730323792,"missteps take what was otherwise a fascinating , riveting story and send it down the path of the mundane .","Skipped"
1.0,88.0,1.0,0.03273838758468628,"[[meticulously]] uncovers a trail of outrageous force and craven concealment .",0.0,0.9781836271286011,"[[conscientiously]] uncovers a trail of outrageous force and craven concealment .","Successful"
1.0,240.0,1.0,0.0033710598945617676,"pete's [[screenplay]] manages to find that real [[natural]] , even-flowing [[tone]] that few movies are able to accomplish .",0.0,0.9886795282363892,"pete's [[suppositions]] manages to find that real [[congenital]] , even-flowing [[tonnes]] that few movies are able to accomplish .","Successful"
0.0,89.0,0.0,0.004918217658996582,"a [[rehash]] of every gangster movie from the past decade .",1.0,0.9987500905990601,"a [[reliving]] of every gangster movie from the past decade .","Successful"
0.0,307.0,0.0,0.0012329816818237305,"the only young people who possibly will [[enjoy]] it are infants . . . who might be [[distracted]] by the movie's [[quick]] movements and sounds .",1.0,0.7635341286659241,"the only young people who possibly will [[have]] it are infants . . . who might be [[embezzled]] by the movie's [[speedy]] movements and sounds .","Successful"
0.0,179.0,0.0,0.000656425952911377,"the movie is [[almost]] completely [[lacking]] in suspense , surprise and consistent emotional conviction .",1.0,0.9990068674087524,"the movie is [[nigh]] completely [[dearth]] in suspense , surprise and consistent emotional conviction .","Successful"
0.0,724.0,0.0,0.0008890032768249512,"in his [[determination]] to lighten the [[heavy]] subject matter , silberling [[also]] , to a [[certain]] extent , trivializes the movie with too many [[nervous]] [[gags]] and pratfalls .",0.0,0.3890712261199951,"in his [[willingness]] to lighten the [[cumbersome]] subject matter , silberling [[equally]] , to a [[confident]] extent , trivializes the movie with too many [[neurological]] [[jaws]] and pratfalls .","Successful"
1.0,73.0,1.0,0.0005370974540710449,"steadfastly uncinematic but [[powerfully]] [[dramatic]] .",0.0,0.992143452167511,"steadfastly uncinematic but [[mightily]] [[whopping]] .","Successful"
1.0,1.0,0.0,0.9972812533378601,"like a precious and finely cut diamond , magnificent to behold in its sparkling beauty yet in reality it's one tough rock .",0.0,0.9972812533378601,"like a precious and finely cut diamond , magnificent to behold in its sparkling beauty yet in reality it's one tough rock .","Skipped"
1.0,59.0,1.0,0.0014961957931518555,"an energetic and engaging film that never [[pretends]] to be something it isn't .",0.0,0.7553081512451172,"an energetic and engaging film that never [[persuades]] to be something it isn't .","Successful"
0.0,315.0,0.0,0.000737607479095459,"broder's [[screenplay]] is [[shallow]] , [[offensive]] and [[redundant]] , with [[pitifully]] few [[real]] laughs .",0.0,0.001390695571899414,"broder's [[arena]] is [[seeming]] , [[demeaning]] and [[unusable]] , with [[miserably]] few [[truly]] laughs .","Failed"
0.0,138.0,0.0,0.009446203708648682,"it's a [[movie]] that ends with truckzilla , for cryin' out loud . if that doesn't [[clue]] you in that something's horribly wrong , nothing will .",0.0,0.41775810718536377,"it's a [[teatro]] that ends with truckzilla , for cryin' out loud . if that doesn't [[enigma]] you in that something's horribly wrong , nothing will .","Successful"
0.0,290.0,0.0,0.00047767162322998047,"barney [[throws]] away the goodwill the first half of his movie generates by orchestrating a finale that is impenetrable and [[dull]] .",1.0,0.9984297752380371,"barney [[evokes]] away the goodwill the first half of his movie generates by orchestrating a finale that is impenetrable and [[blunt]] .","Successful"
1.0,1.0,1.0,0.3936346173286438,"your children will be occupied for 72 minutes .",1.0,0.3936346173286438,"your children will be occupied for 72 minutes .","Skipped"
0.0,1.0,0.0,0.3027251958847046,"two hours of sepia-tinted heavy metal images and surround sound effects of people moaning .",0.0,0.3027251958847046,"two hours of sepia-tinted heavy metal images and surround sound effects of people moaning .","Skipped"
0.0,1246.0,0.0,0.0004341006278991699,"tom green and an ivy league college should [[never]] [[appear]] together on a marquee , [[especially]] when the [[payoff]] is an unschooled comedy [[like]] [[stealing]] harvard , which [[fails]] to keep 80 minutes from seeming like 800 .",1.0,0.5832403898239136,"tom green and an ivy league college should [[siempre]] [[emerges]] together on a marquee , [[concretely]] when the [[rewarding]] is an unschooled comedy [[analogous]] [[larceny]] harvard , which [[omitted]] to keep 80 minutes from seeming like 800 .","Successful"
1.0,1.0,0.0,0.9993113279342651,"a movie where story is almost an afterthought amidst a swirl of colors and inexplicable events .",0.0,0.9993113279342651,"a movie where story is almost an afterthought amidst a swirl of colors and inexplicable events .","Skipped"
0.0,1.0,1.0,0.9925059676170349,"it takes you somewhere you're not likely to have seen before , but beneath the exotic surface ( and exotic dancing ) it's surprisingly old-fashioned .",1.0,0.9925059676170349,"it takes you somewhere you're not likely to have seen before , but beneath the exotic surface ( and exotic dancing ) it's surprisingly old-fashioned .","Skipped"
0.0,1.0,0.0,0.387866735458374,"the densest distillation of roberts' movies ever made .",0.0,0.387866735458374,"the densest distillation of roberts' movies ever made .","Skipped"
1.0,156.0,1.0,0.0058675408363342285,"twohy knows how to inflate the mundane into the scarifying , and gets [[full]] mileage out of the rolling of a stray barrel or the unexpected blast of a phonograph record .",0.0,0.8627645969390869,"twohy knows how to inflate the mundane into the scarifying , and gets [[exhaustive]] mileage out of the rolling of a stray barrel or the unexpected blast of a phonograph record .","Successful"
1.0,56.0,1.0,0.23093026876449585,"the kind of [[trifle]] that date nights were invented for .",0.0,0.9993972778320312,"the kind of [[misery]] that date nights were invented for .","Successful"
1.0,88.0,1.0,0.005646824836730957,"ana's journey is not a stereotypical one of self-discovery , as she's already [[comfortable]] enough in her own skin to be proud of her rubenesque physique . . .",0.0,0.7999178767204285,"ana's journey is not a stereotypical one of self-discovery , as she's already [[squeamish]] enough in her own skin to be proud of her rubenesque physique . . .","Successful"
1.0,66.0,1.0,0.0016769766807556152,"an old-fashioned but emotionally [[stirring]] adventure tale of the kind they rarely make anymore .",0.0,0.9993067979812622,"an old-fashioned but emotionally [[agitate]] adventure tale of the kind they rarely make anymore .","Successful"
1.0,91.0,1.0,0.0021629929542541504,". . . a fairly disposable yet still [[entertaining]] b picture .",0.0,0.9786457419395447,". . . a fairly disposable yet still [[entertainment]] b picture .","Successful"
1.0,792.0,1.0,0.002129077911376953,"a [[real]] audience-pleaser that will [[strike]] a [[chord]] with [[anyone]] who's [[ever]] waited in a doctor's [[office]] , [[emergency]] [[room]] , [[hospital]] [[bed]] or [[insurance]] [[company]] [[office]] .",1.0,0.013354957103729248,"a [[genuine]] audience-pleaser that will [[befallen]] a [[jumpy]] with [[anybody]] who's [[already]] waited in a doctor's [[department]] , [[unscheduled]] [[rooms]] , [[clinic]] [[slumber]] or [[insurers]] [[entrepreneurial]] [[board]] .","Failed"
0.0,75.0,0.0,0.00045162439346313477,"swims in [[mediocrity]] , sticking its head up for a breath of fresh air now and then .",1.0,0.9931439161300659,"swims in [[isamu]] , sticking its head up for a breath of fresh air now and then .","Successful"
1.0,288.0,1.0,0.0030269622802734375,""" austin powers in goldmember "" has the right stuff for [[silly]] summer entertainment and has enough laughs to sustain interest to the [[end]] .",0.0,0.9675396084785461,""" austin powers in goldmember "" has the right stuff for [[stupid]] summer entertainment and has enough laughs to sustain interest to the [[discontinue]] .","Successful"
1.0,100.0,1.0,0.007079780101776123,"you've already seen city by the sea under a variety of titles , but it's [[worth]] yet another visit .",0.0,0.9950271844863892,"you've already seen city by the sea under a variety of titles , but it's [[penalty]] yet another visit .","Successful"
1.0,129.0,1.0,0.12223213911056519,"an odd drama set in the world of lingerie models and bar dancers in the midwest that held my interest precisely because it didn't [[try]] to .",0.0,0.9961705207824707,"an odd drama set in the world of lingerie models and bar dancers in the midwest that held my interest precisely because it didn't [[strive]] to .","Successful"
0.0,491.0,0.0,0.000491023063659668,"the [[plot]] is paper-thin and the [[characters]] aren't [[interesting]] enough to [[watch]] them [[go]] about their [[daily]] [[activities]] for [[two]] [[whole]] [[hours]] .",0.0,0.0012531280517578125,"the [[graph]] is paper-thin and the [[idiosyncrasies]] aren't [[attractive]] enough to [[supervisory]] them [[proceed]] about their [[normal]] [[initiative]] for [[both]] [[together]] [[schedules]] .","Failed"
1.0,82.0,1.0,0.005174756050109863,"while the story does seem pretty unbelievable at times , it's awfully [[entertaining]] to watch .",0.0,0.957379937171936,"while the story does seem pretty unbelievable at times , it's awfully [[comical]] to watch .","Successful"
1.0,1.0,0.0,0.9820529222488403,"if you're in the right b-movie frame of mind , it may just scare the pants off you .",0.0,0.9820529222488403,"if you're in the right b-movie frame of mind , it may just scare the pants off you .","Skipped"
1.0,46.0,1.0,0.2982723116874695,"you will likely prefer to [[keep]] on watching .",0.0,0.9425095915794373,"you will likely prefer to [[conserve]] on watching .","Successful"
1.0,71.0,1.0,0.00813758373260498,"it's a [[sharp]] movie about otherwise dull subjects .",0.0,0.9994519352912903,"it's a [[draconian]] movie about otherwise dull subjects .","Successful"
1.0,275.0,1.0,0.0007349848747253418,"time out is as serious as a pink slip . and more than that , it's an [[observant]] , unfussily [[poetic]] [[meditation]] about identity and alienation .",0.0,0.7725706100463867,"time out is as serious as a pink slip . and more than that , it's an [[cautious]] , unfussily [[rhymed]] [[meditate]] about identity and alienation .","Successful"
0.0,134.0,0.0,0.0017138123512268066,"bean drops the ball too many times . . . [[hoping]] the nifty premise will create enough interest to make up for an unfocused screenplay .",1.0,0.8712987899780273,"bean drops the ball too many times . . . [[await]] the nifty premise will create enough interest to make up for an unfocused screenplay .","Successful"
0.0,1.0,1.0,0.9944061040878296,"diaz , applegate , blair and posey are suitably kooky which should appeal to women and they strip down often enough to keep men alert , if not amused .",1.0,0.9944061040878296,"diaz , applegate , blair and posey are suitably kooky which should appeal to women and they strip down often enough to keep men alert , if not amused .","Skipped"
1.0,189.0,1.0,0.002301633358001709,"what [[sets]] this romantic comedy apart from most hollywood romantic comedies is its low-key [[way]] of tackling what seems like done-to-death material .",0.0,0.9774187803268433,"what [[gambling]] this romantic comedy apart from most hollywood romantic comedies is its low-key [[forma]] of tackling what seems like done-to-death material .","Successful"
0.0,1.0,1.0,0.9980992078781128,"skillful as he is , mr . shyamalan is undone by his pretensions .",1.0,0.9980992078781128,"skillful as he is , mr . shyamalan is undone by his pretensions .","Skipped"
1.0,544.0,1.0,0.0004703998565673828,"a [[vivid]] , spicy footnote to history , and a [[movie]] that [[grips]] and [[holds]] you in [[rapt]] attention from start to finish .",0.0,0.6613713502883911,"a [[perennial]] , spicy footnote to history , and a [[cinematography]] that [[wrist]] and [[owns]] you in [[stupefied]] attention from start to finish .","Successful"
0.0,179.0,0.0,0.0029878616333007812,"the metaphors are [[provocative]] , but too often , the viewer is left [[puzzled]] by the mechanics of the delivery .",1.0,0.9404463171958923,"the metaphors are [[inflammatory]] , but too often , the viewer is left [[intrigued]] by the mechanics of the delivery .","Successful"
0.0,234.0,0.0,0.003731250762939453,"[[supposedly]] authentic account of a historical event that's far too tragic to merit such [[superficial]] treatment .",1.0,0.984906017780304,"[[visibly]] authentic account of a historical event that's far too tragic to merit such [[overt]] treatment .","Successful"
0.0,114.0,0.0,0.0016350150108337402,"i was [[hoping]] that it would be sleazy and fun , but it was [[neither]] .",1.0,0.9949210286140442,"i was [[expect]] that it would be sleazy and fun , but it was [[ani]] .","Successful"
0.0,589.0,0.0,0.0004108548164367676,"the [[movie]] isn't [[painfully]] [[bad]] , [[something]] to be '[[fully]] experienced' ; it's just tediously [[bad]] , [[something]] to be [[fully]] [[forgotten]] .",0.0,0.07534825801849365,"the [[cinematography]] isn't [[horribly]] [[inauspicious]] , [[somethin]] to be '[[exactly]] experienced' ; it's just tediously [[inauspicious]] , [[doesnt]] to be [[altogether]] [[overlooked]] .","Failed"
0.0,1.0,1.0,0.856738269329071,"the plot is romantic comedy boilerplate from start to finish .",1.0,0.856738269329071,"the plot is romantic comedy boilerplate from start to finish .","Skipped"
1.0,209.0,1.0,0.0076233744621276855,"there's a lot of tooth in roger dodger . but what's [[nice]] is that there's a casual [[intelligence]] that permeates the script .",0.0,0.9962775707244873,"there's a lot of tooth in roger dodger . but what's [[gentil]] is that there's a casual [[spy]] that permeates the script .","Successful"
0.0,211.0,0.0,0.0007761716842651367,"[[overburdened]] with [[complicated]] [[plotting]] and [[banal]] dialogue",0.0,0.0024836063385009766,"[[congested]] with [[difficult]] [[planning]] and [[inane]] dialogue","Failed"
1.0,557.0,1.0,0.0004455447196960449,"a [[quirky]] [[comedy]] set in [[newfoundland]] that [[cleverly]] [[captures]] the dry [[wit]] that's so [[prevalent]] on the [[rock]] .",0.0,0.8592824339866638,"a [[fickle]] [[travesty]] set in [[yukon]] that [[smartly]] [[arrested]] the dry [[wits]] that's so [[omnipresent]] on the [[ocr]] .","Successful"
0.0,181.0,0.0,0.0015160441398620605,"totally [[overwrought]] , deeply biased , and wholly designed to make you feel guilty about ignoring what the filmmakers clearly believe are the greatest musicians of all time .",1.0,0.9881765246391296,"totally [[excitable]] , deeply biased , and wholly designed to make you feel guilty about ignoring what the filmmakers clearly believe are the greatest musicians of all time .","Successful"
1.0,342.0,1.0,0.0017160773277282715,"what's most [[memorable]] about circuit is that it's [[shot]] on digital video , whose tiny camera enables shafer to navigate spaces both large . . . and small . . . with considerable aplomb .",0.0,0.8776373863220215,"what's most [[dramatic]] about circuit is that it's [[slain]] on digital video , whose tiny camera enables shafer to navigate spaces both large . . . and small . . . with considerable aplomb .","Successful"
0.0,1.0,1.0,0.9982118010520935,"an encouraging effort from mccrudden",1.0,0.9982118010520935,"an encouraging effort from mccrudden","Skipped"
0.0,101.0,0.0,0.0028102993965148926,"charly comes off as emotionally [[manipulative]] and sadly imitative of innumerable past love story derisions .",1.0,0.8961993455886841,"charly comes off as emotionally [[sly]] and sadly imitative of innumerable past love story derisions .","Successful"
1.0,49.0,1.0,0.000433504581451416,"a [[sensitive]] and astute first feature by anne-sophie birot .",1.0,0.334297239780426,"a [[brittle]] and astute first feature by anne-sophie birot .","Successful"
0.0,28.0,0.0,0.0005379319190979004,"as [[pedestrian]] as they come .",1.0,0.9894777536392212,"as [[walkway]] as they come .","Successful"
1.0,166.0,1.0,0.0009086132049560547,"does a [[good]] [[job]] of establishing a time and place , and of telling a fascinating character's story .",0.0,0.9714587330818176,"does a [[allright]] [[labor]] of establishing a time and place , and of telling a fascinating character's story .","Successful"
1.0,453.0,1.0,0.002697467803955078,"the [[artwork]] is [[spectacular]] and [[unlike]] most animaton from [[japan]] , the [[characters]] [[move]] with [[grace]] and [[panache]] .",1.0,0.008830666542053223,"the [[artistry]] is [[impressive]] and [[notwithstanding]] most animaton from [[yen]] , the [[traits]] [[wiggle]] with [[thanks]] and [[gravitas]] .","Failed"
0.0,29.0,0.0,0.008121132850646973,"as [[saccharine]] as it is disposable .",0.0,0.3693525195121765,"as [[schmaltz]] as it is disposable .","Successful"
1.0,240.0,1.0,0.00047528743743896484,"here polanski looks [[back]] on those places he saw at childhood , and [[captures]] them by freeing them from artefact , and by showing them heartbreakingly drably .",1.0,0.49294012784957886,"here polanski looks [[backseat]] on those places he saw at childhood , and [[arrested]] them by freeing them from artefact , and by showing them heartbreakingly drably .","Successful"
1.0,92.0,1.0,0.00387495756149292,"williams absolutely [[nails]] sy's queasy infatuation and overall strangeness .",0.0,0.9972728490829468,"williams absolutely [[shucks]] sy's queasy infatuation and overall strangeness .","Successful"
1.0,58.0,1.0,0.030373871326446533,"'if you are in the mood for an intelligent weepy , it can easily worm its way into your [[heart]] . '",0.0,0.9361153841018677,"'if you are in the mood for an intelligent weepy , it can easily worm its way into your [[heartland]] . '","Successful"
1.0,146.0,1.0,0.0011652112007141113,"gangster no . 1 is solid , [[satisfying]] [[fare]] for [[adults]] .",0.0,0.6881090402603149,"gangster no . 1 is solid , [[satisfactory]] [[costs]] for [[ripen]] .","Successful"
1.0,1.0,0.0,0.9989185333251953,"suffers from its timid parsing of the barn-side target of sons trying to breach gaps in their relationships with their fathers .",0.0,0.9989185333251953,"suffers from its timid parsing of the barn-side target of sons trying to breach gaps in their relationships with their fathers .","Skipped"
1.0,389.0,1.0,0.0005848407745361328,"without [[resorting]] to camp or parody , haynes ( like sirk , but differently ) has transformed the rhetoric of hollywood melodrama into [[something]] provocative , rich , and strange .",0.0,0.9993340969085693,"without [[appeal]] to camp or parody , haynes ( like sirk , but differently ) has transformed the rhetoric of hollywood melodrama into [[nothin]] provocative , rich , and strange .","Successful"
0.0,294.0,0.0,0.0007156729698181152,"further [[sad]] evidence that tom tykwer , director of the resonant and sense-spinning run lola run , has turned out to be a one-trick pony -- a [[maker]] of softheaded metaphysical claptrap .",1.0,0.9663587808609009,"further [[triste]] evidence that tom tykwer , director of the resonant and sense-spinning run lola run , has turned out to be a one-trick pony -- a [[artisan]] of softheaded metaphysical claptrap .","Successful"
1.0,620.0,1.0,0.0007673501968383789,"beautifully crafted and [[brutally]] [[honest]] , promises offers an [[unexpected]] window into the complexities of the middle east [[struggle]] and into the humanity of its people .",0.0,0.7477487325668335,"beautifully crafted and [[abruptly]] [[frank]] , promises offers an [[unintentional]] window into the complexities of the middle east [[battling]] and into the humanity of its people .","Successful"
1.0,312.0,1.0,0.0016741156578063965,"much credit [[must]] be given to the water-camera operating team of don king , sonny miller , and michael stewart . their work is [[fantastic]] .",0.0,0.5895410776138306,"much credit [[ought]] be given to the water-camera operating team of don king , sonny miller , and michael stewart . their work is [[wondrous]] .","Successful"
1.0,1.0,0.0,0.9984419345855713,"shiner can certainly go the distance , but isn't world championship material",0.0,0.9984419345855713,"shiner can certainly go the distance , but isn't world championship material","Skipped"
