"ground_truth_output","num_queries","original_output","original_score","original_text","perturbed_output","perturbed_score","perturbed_text","result_type"
1.0,1120.0,1.0,0.0006706714630126953,"an [[engrossing]] [[iranian]] [[film]] about [[two]] itinerant teachers and some [[lost]] and [[desolate]] [[people]] they encounter in a place where war has [[savaged]] the lives and liberties of the poor and the dispossessed .",0.0,0.8345136046409607,"an [[intriguing]] [[iraq]] [[flick]] about [[twice]] itinerant teachers and some [[wasted]] and [[sterile]] [[pueblo]] they encounter in a place where war has [[bashed]] the lives and liberties of the poor and the dispossessed .","Successful"
0.0,375.0,0.0,0.0011172890663146973,"[[certainly]] [[beautiful]] to look at , but its not very [[informative]] about its titular character and no more [[challenging]] than your [[average]] television biopic .",0.0,0.4510278105735779,"[[definitely]] [[fantastic]] to look at , but its not very [[incisive]] about its titular character and no more [[problematic]] than your [[media]] television biopic .","Successful"
0.0,1.0,1.0,0.6179834008216858,"those eternally devoted to the insanity of black will have an intermittently good time . feel free to go get popcorn whenever he's not onscreen .",1.0,0.6179834008216858,"those eternally devoted to the insanity of black will have an intermittently good time . feel free to go get popcorn whenever he's not onscreen .","Skipped"
1.0,162.0,1.0,0.0004468560218811035,"an [[engrossing]] story that [[combines]] psychological drama , sociological reflection , and high-octane thriller .",0.0,0.9937928915023804,"an [[intriguing]] story that [[amalgam]] psychological drama , sociological reflection , and high-octane thriller .","Successful"
0.0,341.0,0.0,0.0003845691680908203,"a [[boring]] [[masquerade]] ball where normally good actors , even kingsley , are made to look [[bad]] .",1.0,0.8912604451179504,"a [[piercing]] [[irony]] ball where normally good actors , even kingsley , are made to look [[amiss]] .","Successful"
1.0,1.0,0.0,0.9815628528594971,"an involving , inspirational drama that sometimes falls prey to its sob-story trappings .",0.0,0.9815628528594971,"an involving , inspirational drama that sometimes falls prey to its sob-story trappings .","Skipped"
1.0,411.0,1.0,0.0007962584495544434,"this is a [[shrewd]] and [[effective]] [[film]] from a [[director]] who [[understands]] how to [[create]] and [[sustain]] a [[mood]] .",1.0,0.003237485885620117,"this is a [[crafty]] and [[valid]] [[kino]] from a [[warden]] who [[knows]] how to [[make]] and [[keep]] a [[temper]] .","Failed"
1.0,152.0,1.0,0.04187220335006714,"the acting in pauline and paulette is good all round , but what really [[sets]] the film apart is debrauwer's refusal to push the easy emotional buttons .",0.0,0.9982375502586365,"the acting in pauline and paulette is good all round , but what really [[gambling]] the film apart is debrauwer's refusal to push the easy emotional buttons .","Successful"
0.0,170.0,0.0,0.008479654788970947,"the beautiful images and solemn words [[cannot]] disguise the slack complacency of [godard's] vision , any more than the gorgeous piano and strings on the soundtrack can drown out the tinny self-righteousness of his voice .",1.0,0.9912980794906616,"the beautiful images and solemn words [[remarkable]] disguise the slack complacency of [godard's] vision , any more than the gorgeous piano and strings on the soundtrack can drown out the tinny self-righteousness of his voice .","Successful"
1.0,146.0,1.0,0.00379866361618042,"if you're [[looking]] for an intelligent movie in which you can release your pent up anger , enough is just the [[ticket]] you need .",0.0,0.9007412791252136,"if you're [[researches]] for an intelligent movie in which you can release your pent up anger , enough is just the [[voucher]] you need .","Successful"
1.0,203.0,1.0,0.006496727466583252,"[the film] tackles the topic of relationships in such a [[straightforward]] , emotionally honest manner that by the end , it's impossible to ascertain whether the film is , at its core , deeply pessimistic or quietly hopeful .",0.0,0.9913447499275208,"[the film] tackles the topic of relationships in such a [[merely]] , emotionally honest manner that by the end , it's impossible to ascertain whether the film is , at its core , deeply pessimistic or quietly hopeful .","Successful"
1.0,87.0,1.0,0.00656735897064209,". . . quite [[good]] at providing some good old fashioned spooks .",0.0,0.994275689125061,". . . quite [[opportune]] at providing some good old fashioned spooks .","Successful"
1.0,68.0,1.0,0.00060272216796875,"dense , [[exhilarating]] [[documentary]] .",0.0,0.9990711808204651,"dense , [[encouraging]] [[paperwork]] .","Successful"
0.0,393.0,0.0,0.0007017850875854492,"the 70-year-old godard has become , to judge from in praise of love , the sort of [[bitter]] old crank who sits behind his light meter and harangues the supposed injustices of the artistic world-at-large [[without]] doing all that much to correct them .",1.0,0.9653018712997437,"the 70-year-old godard has become , to judge from in praise of love , the sort of [[fierce]] old crank who sits behind his light meter and harangues the supposed injustices of the artistic world-at-large [[but]] doing all that much to correct them .","Successful"
1.0,301.0,1.0,0.0010204911231994629,"there's real visual [[charge]] to the filmmaking , and a [[strong]] erotic [[spark]] to the most crucial lip-reading sequence .",0.0,0.9980727434158325,"there's real visual [[fees]] to the filmmaking , and a [[emphatic]] erotic [[moxie]] to the most crucial lip-reading sequence .","Successful"
1.0,1.0,0.0,0.9635681509971619,"fairy-tale formula , serves as a paper skeleton for some very good acting , dialogue , comedy , direction and especially charm .",0.0,0.9635681509971619,"fairy-tale formula , serves as a paper skeleton for some very good acting , dialogue , comedy , direction and especially charm .","Skipped"
0.0,194.0,0.0,0.000582575798034668,"the very simple story seems too [[simple]] and the working out of the plot [[almost]] arbitrary .",0.0,0.3656485080718994,"the very simple story seems too [[uncomplicated]] and the working out of the plot [[hardly]] arbitrary .","Successful"
1.0,261.0,1.0,0.0009624958038330078,"[[demonstrates]] a [[vivid]] [[imagination]] and an impressive [[style]] that result in some [[terrific]] setpieces .",0.0,0.6423988938331604,"[[testifies]] a [[perennial]] [[conception]] and an impressive [[styling]] that result in some [[resplendent]] setpieces .","Successful"
1.0,210.0,1.0,0.0005079507827758789,"this is one of those [[rare]] docs that paints a [[grand]] picture of an era and makes the journey feel like a party .",0.0,0.889133632183075,"this is one of those [[sparse]] docs that paints a [[prodigious]] picture of an era and makes the journey feel like a party .","Successful"
0.0,167.0,0.0,0.0007973313331604004,"the film is all over the place , [[really]] . it dabbles all around , [[never]] gaining much momentum .",1.0,0.996401846408844,"the film is all over the place , [[genuine]] . it dabbles all around , [[jamais]] gaining much momentum .","Successful"
0.0,767.0,0.0,0.006183326244354248,"[[none]] of this has the suavity or [[classical]] [[familiarity]] of [[bond]] , but [[much]] of it is [[good]] for a [[laugh]] . the [[problem]] with "" [[xxx]] "" is that its own [[action]] isn't very [[effective]] .",0.0,0.03330433368682861,"[[not]] of this has the suavity or [[classics]] [[familiarize]] of [[guarantor]] , but [[vastly]] of it is [[nice]] for a [[laughs]] . the [[difficulties]] with "" [[incest]] "" is that its own [[initiative]] isn't very [[usefulness]] .","Failed"
0.0,289.0,0.0,0.0015296339988708496,"unfortunately , the [[experience]] of actually watching the movie is [[less]] [[compelling]] than the circumstances of its making .",1.0,0.7514097690582275,"unfortunately , the [[savoring]] of actually watching the movie is [[fewest]] [[incontrovertible]] than the circumstances of its making .","Successful"
1.0,619.0,1.0,0.0006955862045288086,"a [[fun]] family movie that's suitable for all ages -- a movie that will [[make]] you [[laugh]] , [[cry]] and realize , 'it's [[never]] too late to believe in your dreams . '",0.0,0.9952341914176941,"a [[hoot]] family movie that's suitable for all ages -- a movie that will [[afford]] you [[chuckles]] , [[cried]] and realize , 'it's [[nope]] too late to believe in your dreams . '","Successful"
1.0,680.0,1.0,0.0008598566055297852,"[[like]] [[kissing]] jessica stein , amy's orgasm has a key [[strength]] in its willingness to explore its principal [[characters]] with [[honesty]] , insight and humor .",1.0,0.3352113366127014,"[[comparable]] [[fucked]] jessica stein , amy's orgasm has a key [[toughness]] in its willingness to explore its principal [[feature]] with [[franchise]] , insight and humor .","Successful"
0.0,49.0,0.0,0.0006182193756103516,"entertainment more [[disposable]] than hanna-barbera's half-hour cartoons ever were .",1.0,0.9992139935493469,"entertainment more [[accessible]] than hanna-barbera's half-hour cartoons ever were .","Successful"
0.0,1158.0,0.0,0.002037525177001953,"cherry orchard is [[badly]] edited , often [[awkwardly]] [[directed]] and [[suffers]] from the addition of a [[wholly]] [[unnecessary]] pre-credit [[sequence]] [[designed]] to [[give]] some of the characters a 'back [[story]] . '",0.0,0.4690316319465637,"cherry orchard is [[inclement]] edited , often [[stiffly]] [[geared]] and [[adversity]] from the addition of a [[full]] [[unhelpful]] pre-credit [[genome]] [[geared]] to [[allows]] some of the characters a 'back [[storytelling]] . '","Successful"
1.0,1.0,0.0,0.9976139664649963,"sayles has a knack for casting , often resurrecting performers who rarely work in movies now . . . and drawing flavorful performances from bland actors .",0.0,0.9976139664649963,"sayles has a knack for casting , often resurrecting performers who rarely work in movies now . . . and drawing flavorful performances from bland actors .","Skipped"
0.0,234.0,0.0,0.0010945796966552734,"the movie obviously seeks to re-create the excitement of such '50s flicks as jules verne's '20 , 000 leagues under the sea' and the george pal version of h . g . wells' 'the time machine . ' but its storytelling prowess and special effects are both [[listless]] .",1.0,0.8471185564994812,"the movie obviously seeks to re-create the excitement of such '50s flicks as jules verne's '20 , 000 leagues under the sea' and the george pal version of h . g . wells' 'the time machine . ' but its storytelling prowess and special effects are both [[languid]] .","Successful"
0.0,331.0,0.0,0.0010221004486083984,"theological matters aside , the [[movie]] is so [[clumsily]] [[sentimental]] and ineptly directed it may leave you speaking in tongues .",0.0,0.4470868706703186,"theological matters aside , the [[kino]] is so [[cunningly]] [[affectionate]] and ineptly directed it may leave you speaking in tongues .","Successful"
1.0,1.0,0.0,0.8625587224960327,"quando tiros em columbine acerta o alvo ( com o perdão do trocadilho ) , não há como negar o brilhantismo da argumentação de seu diretor .",0.0,0.8625587224960327,"quando tiros em columbine acerta o alvo ( com o perdão do trocadilho ) , não há como negar o brilhantismo da argumentação de seu diretor .","Skipped"
0.0,166.0,0.0,0.0034047961235046387,"not once in the rush to save the day did i become very involved in the proceedings ; to me , it was just a [[matter]] of '[[eh]] . '",1.0,0.7237260341644287,"not once in the rush to save the day did i become very involved in the proceedings ; to me , it was just a [[respect]] of '[[hein]] . '","Successful"
0.0,464.0,0.0,0.002223670482635498,"fessenden continues to do interesting work , and it would be nice to see what he could make with a decent budget . but the [[problem]] with wendigo , for all its effective moments , isn't [[really]] one of [[resources]] .",0.0,0.39203864336013794,"fessenden continues to do interesting work , and it would be nice to see what he could make with a decent budget . but the [[challenges]] with wendigo , for all its effective moments , isn't [[awfully]] one of [[financial]] .","Successful"
1.0,202.0,1.0,0.0005909204483032227,"it's a [[great]] [[american]] [[adventure]] and a [[wonderful]] [[film]] to [[bring]] to imax .",1.0,0.0009526610374450684,"it's a [[tremendous]] [[unidos]] [[fling]] and a [[excellent]] [[movie]] to [[take]] to imax .","Failed"
0.0,200.0,0.0,0.011724710464477539,"this is a children's film in the truest sense . it's packed with adventure and a worthwhile environmental message , so it's great for the kids . parents , on the other hand , will be ahead of the plot at all times , and there isn't [[enough]] clever innuendo to fil",1.0,0.9977156519889832,"this is a children's film in the truest sense . it's packed with adventure and a worthwhile environmental message , so it's great for the kids . parents , on the other hand , will be ahead of the plot at all times , and there isn't [[suffice]] clever innuendo to fil","Successful"
0.0,1.0,1.0,0.9993442893028259,"a very familiar tale , one that's been told by countless filmmakers about italian- , chinese- , irish- , latin- , indian- , russian- and other hyphenate american young men struggling to balance conflicting cultural messages .",1.0,0.9993442893028259,"a very familiar tale , one that's been told by countless filmmakers about italian- , chinese- , irish- , latin- , indian- , russian- and other hyphenate american young men struggling to balance conflicting cultural messages .","Skipped"
1.0,188.0,1.0,0.0015747547149658203,"charlotte [[sometimes]] is a [[gem]] . it's [[always]] [[enthralling]] .",0.0,0.8927549719810486,"charlotte [[seldom]] is a [[jewellery]] . it's [[regularly]] [[interesting]] .","Successful"
0.0,109.0,0.0,0.07068747282028198,"soulless and -- even more damning -- virtually joyless , xxx achieves [[near]] virtuosity in its crapulence .",1.0,0.9880180358886719,"soulless and -- even more damning -- virtually joyless , xxx achieves [[close]] virtuosity in its crapulence .","Successful"
0.0,1.0,1.0,0.989131510257721,"a formula family tearjerker told with a heavy irish brogue . . . accentuating , rather than muting , the plot's saccharine thrust .",1.0,0.989131510257721,"a formula family tearjerker told with a heavy irish brogue . . . accentuating , rather than muting , the plot's saccharine thrust .","Skipped"
1.0,149.0,1.0,0.003793954849243164,"[[manages]] to accomplish what few sequels can -- it equals the original and in some ways even [[betters]] it .",0.0,0.9980455040931702,"[[runs]] to accomplish what few sequels can -- it equals the original and in some ways even [[disdained]] it .","Successful"
0.0,38.0,0.0,0.0017914772033691406,"an ugly , [[revolting]] movie .",1.0,0.9965986609458923,"an ugly , [[despicable]] movie .","Successful"
0.0,377.0,0.0,0.0009042024612426758,"there's not [[one]] [[decent]] [[performance]] from the [[cast]] and not [[one]] [[clever]] [[line]] of [[dialogue]] .",0.0,0.0017514228820800781,"there's not [[persona]] [[satisfactory]] [[yield]] from the [[casting]] and not [[persona]] [[intelligent]] [[accordance]] of [[dialogues]] .","Failed"
1.0,262.0,1.0,0.0004589557647705078,"a [[compelling]] [[story]] of musical [[passion]] against [[governmental]] [[odds]] .",0.0,0.8978235125541687,"a [[irresistible]] [[conte]] of musical [[fervour]] against [[council]] [[ratings]] .","Successful"
0.0,302.0,0.0,0.000695347785949707,"the nonstop artifice ultimately [[proves]] tiresome , with the surface histrionics [[failing]] to [[compensate]] for the paper-thin characterizations and facile situations .",1.0,0.8267208337783813,"the nonstop artifice ultimately [[highlights]] tiresome , with the surface histrionics [[drawback]] to [[rewarded]] for the paper-thin characterizations and facile situations .","Successful"
1.0,196.0,1.0,0.0009298920631408691,"jones has tackled a meaty subject and drawn [[engaging]] characters while peppering the [[pages]] with memorable zingers .",0.0,0.9922869801521301,"jones has tackled a meaty subject and drawn [[involving]] characters while peppering the [[hosting]] with memorable zingers .","Successful"
1.0,58.0,1.0,0.011383235454559326,"some of the most [[inventive]] silliness you are likely to witness in a movie theatre for some time .",0.0,0.998310923576355,"some of the most [[inventor]] silliness you are likely to witness in a movie theatre for some time .","Successful"
0.0,16.0,0.0,0.0008069872856140137,"this u-boat doesn't have a [[captain]] .",0.0,0.2724837064743042,"this u-boat doesn't have a [[yucca]] .","Failed"
1.0,67.0,1.0,0.0035247206687927246,"there is a general air of exuberance in all about the benjamins that's [[hard]] to resist .",0.0,0.5348504781723022,"there is a general air of exuberance in all about the benjamins that's [[laborious]] to resist .","Successful"
1.0,1.0,0.0,0.7457571029663086,"the picture's fascinating byways are littered with trenchant satirical jabs at the peculiar egocentricities of the acting breed .",0.0,0.7457571029663086,"the picture's fascinating byways are littered with trenchant satirical jabs at the peculiar egocentricities of the acting breed .","Skipped"
0.0,1.0,1.0,0.9952598214149475,"though its rather routine script is loaded with familiar situations , the movie has a cinematic fluidity and sense of intelligence that makes it work more than it probably should .",1.0,0.9952598214149475,"though its rather routine script is loaded with familiar situations , the movie has a cinematic fluidity and sense of intelligence that makes it work more than it probably should .","Skipped"
0.0,69.0,0.0,0.0004100203514099121,"it should be interesting , it should be poignant , it turns out to be affected and [[boring]] .",1.0,0.9854366183280945,"it should be interesting , it should be poignant , it turns out to be affected and [[piercing]] .","Successful"
0.0,131.0,0.0,0.0020055770874023438,"the [[characters]] . . . are paper-thin , and their personalities undergo [[radical]] changes when it suits the script .",1.0,0.8970961570739746,"the [[hallmarks]] . . . are paper-thin , and their personalities undergo [[utmost]] changes when it suits the script .","Successful"
0.0,23.0,0.0,0.005776107311248779,"narc is all [[menace]] and atmosphere .",1.0,0.9979461431503296,"narc is all [[menacing]] and atmosphere .","Successful"
0.0,116.0,0.0,0.004010260105133057,"it's hard to pity the 'plain' girl who becomes a ravishing waif after applying a smear of lip-gloss . rather , [[pity]] anyone who sees this mishmash .",0.0,0.39443522691726685,"it's hard to pity the 'plain' girl who becomes a ravishing waif after applying a smear of lip-gloss . rather , [[compassion]] anyone who sees this mishmash .","Successful"
1.0,215.0,1.0,0.0038567185401916504,"literary purists [[may]] not be pleased , but as far as mainstream matinee-style entertainment goes , it does a bang-up [[job]] of pleasing the crowds .",1.0,0.42279207706451416,"literary purists [[maggio]] not be pleased , but as far as mainstream matinee-style entertainment goes , it does a bang-up [[tasks]] of pleasing the crowds .","Successful"
0.0,1.0,1.0,0.9244798421859741,"where the film falters is in its tone .",1.0,0.9244798421859741,"where the film falters is in its tone .","Skipped"
1.0,232.0,1.0,0.0007808208465576172,"it uses some of the figures from the real-life story to portray themselves in the film . the result is a [[powerful]] , naturally [[dramatic]] piece of low-budget filmmaking .",0.0,0.9994566440582275,"it uses some of the figures from the real-life story to portray themselves in the film . the result is a [[fort]] , naturally [[prodigious]] piece of low-budget filmmaking .","Successful"
0.0,130.0,0.0,0.2775605320930481,"davis the performer is plenty fetching enough , but she needs to shake up the mix , and [[work]] in something that doesn't feel like a half-baked stand-up routine .",1.0,0.9883551597595215,"davis the performer is plenty fetching enough , but she needs to shake up the mix , and [[cooperation]] in something that doesn't feel like a half-baked stand-up routine .","Successful"
0.0,1.0,0.0,0.3979039192199707,"though excessively tiresome , the uncertainty principle , as verbally pretentious as the title may be , has its handful of redeeming features , as long as you discount its ability to bore .",0.0,0.3979039192199707,"though excessively tiresome , the uncertainty principle , as verbally pretentious as the title may be , has its handful of redeeming features , as long as you discount its ability to bore .","Skipped"
0.0,150.0,0.0,0.001310884952545166,"it feels [[like]] very light errol morris , focusing on eccentricity but failing , ultimately , to make something bigger out of its scrapbook of oddballs .",0.0,0.31790411472320557,"it feels [[loved]] very light errol morris , focusing on eccentricity but failing , ultimately , to make something bigger out of its scrapbook of oddballs .","Successful"
1.0,39.0,1.0,0.007269442081451416,"very predictable but [[still]] entertaining",0.0,0.9934362769126892,"very predictable but [[once]] entertaining","Successful"
0.0,679.0,0.0,0.0006064176559448242,". . [[little]] [[action]] , [[almost]] no [[suspense]] or believable [[tension]] , one-dimensional [[characters]] up the wazoo and [[sets]] that can only be described as sci-fi [[generic]] .",0.0,0.4736340641975403,". . [[low]] [[measurement]] , [[near]] no [[wait]] or believable [[taut]] , one-dimensional [[characteristics]] up the wazoo and [[defines]] that can only be described as sci-fi [[ambien]] .","Successful"
0.0,1600.0,0.0,0.000644385814666748,"[[lacks]] the spirit of the [[previous]] [[two]] , and [[makes]] all those [[jokes]] about [[hos]] and [[even]] more [[unmentionable]] [[subjects]] seem [[like]] [[mere]] [[splashing]] [[around]] in the [[muck]] .",0.0,0.0015007257461547852,"[[shortfall]] the spirit of the [[preceding]] [[deux]] , and [[entails]] all those [[gags]] about [[prostitution]] and [[until]] more [[revolting]] [[questions]] seem [[likes]] [[uncomplicated]] [[spatter]] [[in]] in the [[mire]] .","Failed"
0.0,200.0,0.0,0.00040525197982788086,"a [[bland]] , [[obnoxious]] 88-minute infomercial for universal [[studios]] and its ancillary products .",1.0,0.9901618361473083,"a [[uninspired]] , [[despicable]] 88-minute infomercial for universal [[studies]] and its ancillary products .","Successful"
0.0,974.0,0.0,0.0008463859558105469,"[[report]] [[card]] : doesn't [[live]] up to the [[exalted]] tagline - there's [[definite]] [[room]] for [[improvement]] . doesn't [[deserve]] a [[passing]] [[grade]] ( [[even]] on a [[curve]] ) .",0.0,0.0033710598945617676,"[[notification]] [[chart]] : doesn't [[vivre]] up to the [[kareem]] tagline - there's [[unequivocal]] [[salle]] for [[enhancing]] . doesn't [[merit]] a [[crossings]] [[grading]] ( [[additionally]] on a [[bend]] ) .","Failed"
0.0,73.0,0.0,0.0010523200035095215,"the movie is genial but never inspired , and [[little]] about it will stay with you .",1.0,0.8715539574623108,"the movie is genial but never inspired , and [[tiny]] about it will stay with you .","Successful"
1.0,219.0,1.0,0.001344919204711914,"not a schlocky creature [[feature]] but [[something]] far more stylish and cerebral--and , hence , more chillingly [[effective]] .",1.0,0.4542419910430908,"not a schlocky creature [[featuring]] but [[doesnt]] far more stylish and cerebral--and , hence , more chillingly [[usefulness]] .","Successful"
0.0,516.0,0.0,0.0032186508178710938,"director kevin bray excels in breaking glass and marking off the "" miami vice "" checklist of power boats , latin music and dog tracks . he doesn't , [[however]] , deliver [[nearly]] enough of the show's trademark style and flash .",1.0,0.9791796803474426,"director kevin bray excels in breaking glass and marking off the "" miami vice "" checklist of power boats , latin music and dog tracks . he doesn't , [[but]] , deliver [[narrowly]] enough of the show's trademark style and flash .","Successful"
0.0,668.0,0.0,0.0007465481758117676,"a rip-off [[twice]] removed , [[modeled]] after [seagal's] [[earlier]] [[copycat]] under [[siege]] , [[sometimes]] [[referred]] to as [[die]] [[hard]] on a [[boat]] .",0.0,0.024416327476501465,"a rip-off [[doubling]] removed , [[resemble]] after [seagal's] [[anterior]] [[ripping]] under [[seating]] , [[traditionally]] [[cited]] to as [[perish]] [[tough]] on a [[battleship]] .","Failed"
0.0,68.0,0.0,0.00046181678771972656,"routine and [[rather]] [[silly]] .",1.0,0.9513776302337646,"routine and [[abundantly]] [[daft]] .","Successful"
1.0,1.0,0.0,0.9904546141624451,"red dragon "" never cuts corners .",0.0,0.9904546141624451,"red dragon "" never cuts corners .","Skipped"
1.0,353.0,1.0,0.002352297306060791,"the [[strength]] of the [[film]] [[lies]] in its two central performances by sven wollter as the stricken composer and viveka seldahl as his desperate violinist wife .",0.0,0.8530932068824768,"the [[kraft]] of the [[footage]] [[lied]] in its two central performances by sven wollter as the stricken composer and viveka seldahl as his desperate violinist wife .","Successful"
0.0,163.0,0.0,0.013366103172302246,"blood work is [[laughable]] in the solemnity with which it tries to pump life into overworked elements from eastwood's dirty harry period .",1.0,0.6189636588096619,"blood work is [[grotesque]] in the solemnity with which it tries to pump life into overworked elements from eastwood's dirty harry period .","Successful"
1.0,45.0,1.0,0.0026444196701049805,"as it turns out , you can [[go]] home again .",0.0,0.9753343462944031,"as it turns out , you can [[skip]] home again .","Successful"
